{
  "schema_version": "1.0",
  "draft_id": "draft_demo_001",
  "application_id": "app_demo_001",
  "application_revision": 2,
  "draft_revision": 1,
  "status": "generated",
  "sections": [
    {
      "section_id": "section_demo_001",
      "title": "情况说明",
      "content": "申请人自述正在接受示例性治疗；该表述尚无材料支持，仅作为用户陈述保留。",
      "fact_ids": ["fact_demo_001"]
    },
    {
      "section_id": "section_demo_002",
      "title": "费用信息",
      "content": "所提交的虚构费用预估材料载明金额为人民币 12,500.00 元；这仅表示材料内容与该字段一致，不代表材料真伪已经权威核实。",
      "fact_ids": ["fact_demo_002"]
    }
  ],
  "created_at": "2026-10-20T09:40:00Z",
  "confirmed_at": null
}
